[
    {
        "id": 1,
        "name": "Tidal Formation",
        "description": "All Water team: ATK x1.5 for all members",
        "type": "team",
        "rules": [
            {
                "conditions": [{"type": "team_has_element", "params": {"element": 1, "require_all": true}}],
                "outcomes": [{"type": "element_atk_mult", "params": {"element": 0, "multiplier": 1.5}}]
            }
        ]
    },
    {
        "id": 2,
        "name": "Inferno Alliance",
        "description": "3+ Fire members: Fire ATK x2.0",
        "type": "team",
        "rules": [
            {
                "conditions": [{"type": "team_has_element", "params": {"element": 2, "min_count": 3}}],
                "outcomes": [{"type": "element_atk_mult", "params": {"element": 2, "multiplier": 2.0}}]
            }
        ]
    },
    {
        "id": 3,
        "name": "Nature's Pact",
        "description": "2+ Earth members: HP x1.5, REC x1.3",
        "type": "team",
        "rules": [
            {
                "conditions": [{"type": "team_has_element", "params": {"element": 3, "min_count": 2}}],
                "outcomes": [
                    {"type": "element_hp_mult", "params": {"element": 3, "multiplier": 1.5}},
                    {"type": "element_rec_mult", "params": {"element": 3, "multiplier": 1.3}}
                ]
            }
        ]
    },
    {
        "id": 4,
        "name": "Radiant Unity",
        "description": "All Light team: ATK x2.0, HP x1.2",
        "type": "team",
        "rules": [
            {
                "conditions": [{"type": "team_has_element", "params": {"element": 4, "require_all": true}}],
                "outcomes": [
                    {"type": "element_atk_mult", "params": {"element": 0, "multiplier": 2.0}},
                    {"type": "element_hp_mult", "params": {"element": 0, "multiplier": 1.2}}
                ]
            }
        ]
    },
    {
        "id": 5,
        "name": "Shadow Covenant",
        "description": "3+ Dark members: Dark ATK x2.5, HP x0.8",
        "type": "team",
        "rules": [
            {
                "conditions": [{"type": "team_has_element", "params": {"element": 5, "min_count": 3}}],
                "outcomes": [
                    {"type": "element_atk_mult", "params": {"element": 5, "multiplier": 2.5}},
                    {"type": "element_hp_mult", "params": {"element": 5, "multiplier": 0.8}}
                ]
            }
        ]
    }
]
