[
    {
        "id": 1,
        "name": "Water Dragon's Might",
        "description": "Water ATK x2.5",
        "type": "leader",
        "rules": [
            {
                "conditions": [{"type": "always_true", "params": {}}],
                "outcomes": [{"type": "element_atk_mult", "params": {"element": 1, "multiplier": 2.5}}]
            }
        ]
    },
    {
        "id": 2,
        "name": "Phoenix Blaze",
        "description": "Fire ATK x2.5, HP x1.3",
        "type": "leader",
        "rules": [
            {
                "conditions": [{"type": "always_true", "params": {}}],
                "outcomes": [
                    {"type": "element_atk_mult", "params": {"element": 2, "multiplier": 2.5}},
                    {"type": "element_hp_mult", "params": {"element": 2, "multiplier": 1.3}}
                ]
            }
        ]
    },
    {
        "id": 3,
        "name": "Earth's Bastion",
        "description": "Earth HP x2.0, ATK x2.0",
        "type": "leader",
        "rules": [
            {
                "conditions": [{"type": "always_true", "params": {}}],
                "outcomes": [
                    {"type": "element_hp_mult", "params": {"element": 3, "multiplier": 2.0}},
                    {"type": "element_atk_mult", "params": {"element": 3, "multiplier": 2.0}}
                ]
            }
        ]
    },
    {
        "id": 4,
        "name": "Heaven's Grace",
        "description": "Light ATK x2.0, REC x2.0",
        "type": "leader",
        "rules": [
            {
                "conditions": [{"type": "always_true", "params": {}}],
                "outcomes": [
                    {"type": "element_atk_mult", "params": {"element": 4, "multiplier": 2.0}},
                    {"type": "element_rec_mult", "params": {"element": 4, "multiplier": 2.0}}
                ]
            }
        ]
    },
    {
        "id": 5,
        "name": "Reaper's Bargain",
        "description": "Dark ATK x3.0, HP x0.7",
        "type": "leader",
        "rules": [
            {
                "conditions": [{"type": "always_true", "params": {}}],
                "outcomes": [
                    {"type": "element_atk_mult", "params": {"element": 5, "multiplier": 3.0}},
                    {"type": "element_hp_mult", "params": {"element": 5, "multiplier": 0.7}}
                ]
            }
        ]
    }
]
